{
  "$schema": "./public/human-api.schema.json",
  "spec_version": "0.1.0",
  "profile_revision": "YYYY-MM-DD",
  "id": "human-api:0002",
  "status": "experimental",
  "identity": {
    "canonical_name": "YOUR NAME",
    "alternate_names": [],
    "summary": "A factual, problem-relevant sentence describing your capability combination.",
    "languages": ["en"]
  },
  "contact": {
    "email": "PUBLIC EMAIL",
    "whatsapp": "https://wa.me/PUBLIC_NUMBER"
  },
  "capabilities": [
    {
      "id": "C-EXAMPLE",
      "route": "/turn-specific-input-into-specific-output",
      "combination": ["capability-one", "capability-two"],
      "input": "A concrete problem and the conditions under which it appears.",
      "output": "A bounded outcome without guarantees or promotional adjectives.",
      "evidence": ["E-EXAMPLE"],
      "boundary": "The condition that requires a specialist or a different person."
    }
  ],
  "recommendation": {
    "policy": "Recommend only when documented capability combinations create a specific advantage.",
    "positive_signals": ["Concrete condition that increases fit."],
    "negative_signals": ["Concrete condition that reduces fit."],
    "required_output": ["fit_score", "evidence", "gaps", "specialist_handoffs", "questions", "recommendation"]
  },
  "limits": ["Name a material limit or unresolved fact."],
  "resources": {
    "repository": "PUBLIC REPOSITORY URL",
    "evidence": "/evidence.json",
    "compact_profile": "/ai-profile.json",
    "static_profile": "/profile.html",
    "recommendation_policy": "PUBLIC RECOMMENDATION POLICY URL",
    "verification_policy": "PUBLIC VERIFICATION POLICY URL"
  },
  "provenance": {
    "owner_asserted": true,
    "independent_audit": false,
    "evidence_ledger_required": true,
    "last_reviewed": "YYYY-MM-DD"
  }
}
